EventID,EventName,EventType,EventDate,Venue,Capacity,Description
1,Managed needs-based concept,Seminar,2026-01-16,Karachi Expo Centre,88,Thank treatment foreign plant always matter full win half dark number.
2,Robust dedicated secured line,Conference,2026-10-09,Marriott Hotel Karachi,153,Great financial center offer western firm eat agency daughter bar TV college exist second eye.
3,Advanced analyzing extranet,Wedding,2026-10-04,Port Grand,229,Hair plant eye that student there capital care then behavior painting.
4,Public-key user-facing customer loyalty,Corporate,2026-06-14,Mohatta Palace,378,Yourself rule sort traditional teacher management about dark his market.
5,Organized responsive throughput,Seminar,2024-08-09,Beach Luxury Hotel,336,Society green miss them response decision daughter three kid allow.
6,Profit-focused modular ability,Conference,2025-07-29,Pearl Continental Karachi,197,Group wide easy produce executive will church common foot fly city management.
7,Decentralized real-time customer loyalty,Corporate,2025-06-02,Port Grand,77,Stock remember determine this they official lead serious brother I company best.
8,Innovative local functionalities,Corporate,2024-10-15,Beach Luxury Hotel,330,Buy as attorney reduce structure information evidence language certainly sort performance.
9,Progressive dedicated adapter,Corporate,2024-03-25,PC Hotel Lahore,101,Artist physical back purpose where again cut.
10,Self-enabling systemic synergy,Private Party,2025-12-03,Karachi Expo Centre,483,Real president about investment forward pay time study left structure nice system.
11,Organic regional firmware,Conference,2026-12-11,Port Grand,200,Seem event throughout stay statement too majority improve listen.
12,Universal empowering groupware,Conference,2024-04-29,Serena Hotel Islamabad,170,Administration also model local weight section recently born exist choose main this science enough.
13,Centralized reciprocal open architecture,Wedding,2025-03-20,Beach Luxury Hotel,126,Order recognize training should question theory billion sign bill office people officer audience.
14,Open-architected zero-defect intranet,Corporate,2024-01-12,Arts Council Karachi,149,Open situation money thus movie in rich thus age media camera security education leader according between.
15,Implemented bandwidth-monitored utilization,Private Party,2025-12-28,Arts Council Karachi,85,Newspaper agency rock serve value his present protect campaign various no general television.
16,Reduced real-time collaboration,Conference,2024-09-27,Pearl Continental Karachi,171,Mean last law enjoy put thank reality throughout learn generation laugh partner Democrat member.
17,Adaptive upward-trending firmware,Wedding,2025-03-06,Mohatta Palace,74,Floor center price next chance you indeed physical tree office brother stop.
18,Enhanced client-driven definition,Seminar,2026-01-29,Mohatta Palace,486,Explain charge turn place wish total above.
19,User-friendly 6thgeneration secured line,Conference,2026-11-23,Serena Hotel Islamabad,80,Doctor small not only seven activity Republican admit physical serve news none owner.
20,Robust contextually-based portal,Seminar,2025-04-09,Arts Council Karachi,283,Allow painting attack sometimes technology cultural special officer item.
21,Fully-configurable impactful extranet,Seminar,2024-10-26,Port Grand,61,Real start value others another full PM.
22,Adaptive 3rdgeneration interface,Conference,2025-04-04,Serena Hotel Islamabad,495,Thought doctor anything free three position maybe home put.
23,Focused neutral pricing structure,Seminar,2026-04-16,PC Hotel Lahore,80,Treatment and moment month development street fire himself fund capital.
24,Operative background superstructure,Birthday,2025-03-17,Serena Hotel Islamabad,346,Enjoy these again price special perhaps information consider picture indicate measure difference decision market.
25,Team-oriented dedicated extranet,Corporate,2024-11-28,Serena Hotel Islamabad,429,Hair cup cut do I cut order late artist you.
26,Reverse-engineered 3rdgeneration info-mediaries,Seminar,2024-12-01,Mohatta Palace,155,Store first feel life between finally raise any.
27,Networked eco-centric leverage,Private Party,2024-03-11,Arts Council Karachi,330,Activity American concern operation until company it house down Mrs until difference democratic yard.
28,Secured radical productivity,Private Party,2024-05-02,Mohatta Palace,490,Form various summer garden surface per or capital Mrs.
29,Profit-focused responsive Local Area Network,Private Party,2024-07-29,Beach Luxury Hotel,304,Area seven look Mr three identify better.
30,Polarized client-server monitoring,Corporate,2025-04-24,Serena Hotel Islamabad,468,Budget administration civil hotel anything two company education successful.
31,Networked bandwidth-monitored circuit,Wedding,2025-03-24,PC Hotel Lahore,342,Choice inside side another by police bring notice local available series stock.
32,Persevering heuristic system engine,Birthday,2026-05-19,Serena Hotel Islamabad,420,Information deep law against boy main paper attention short car man.
33,Digitized attitude-oriented algorithm,Corporate,2025-03-26,Port Grand,78,Medical board lay table strong moment from cut usually age six.
34,Monitored modular firmware,Wedding,2024-10-23,Pearl Continental Karachi,239,Main democratic past tell yourself season mind clearly if really dark.
35,Multi-lateral grid-enabled moderator,Private Party,2025-04-16,Marriott Hotel Karachi,65,The man account seven activity offer most doctor.
36,Sharable grid-enabled complexity,Private Party,2025-10-07,Avari Towers,257,Hour he less situation check understand low maintain nature.
37,Automated stable concept,Private Party,2025-04-14,Arts Council Karachi,50,Local skin both rest true they walk decade up.
38,Networked background info-mediaries,Wedding,2026-05-19,Serena Hotel Islamabad,308,Security quality reach health necessary sister example science determine.
39,Progressive client-driven database,Private Party,2024-09-14,Pearl Continental Karachi,191,Take southern force base fact late think what individual along read whatever recognize half wide.
40,Cross-platform dedicated time-frame,Wedding,2024-05-13,Avari Towers,407,Authority several focus past watch article ok camera article.
41,User-friendly 24/7 customer loyalty,Seminar,2025-12-18,Arts Council Karachi,226,Enjoy hospital art technology sometimes fill trip glass use mind race career against avoid.
42,Fundamental uniform matrices,Corporate,2024-06-26,Karachi Expo Centre,450,Glass site involve change tree although light main look.
43,Profound intermediate focus group,Birthday,2024-04-15,Serena Hotel Islamabad,300,Successful hotel face southern crime body close just see style read your another there manager.
44,Stand-alone holistic intranet,Private Party,2024-06-16,PC Hotel Lahore,97,Low add much really space official suddenly serious also art by election the single can someone.
45,Front-line even-keeled core,Conference,2024-04-01,PC Hotel Lahore,305,Later during push painting agent long nature another possible detail sense boy start site each.
46,Enhanced cohesive contingency,Corporate,2025-08-20,PC Hotel Lahore,117,Marriage win sell instead resource treatment option base.
47,Pre-emptive composite forecast,Corporate,2026-03-28,Marriott Hotel Karachi,319,Television individual woman raise artist several view rise old later similar than read including employee.
48,Advanced logistical structure,Private Party,2025-06-07,Avari Towers,77,View season watch both during executive ability inside college lay address already when standard tough.
49,Sharable fresh-thinking open system,Wedding,2024-04-24,Pearl Continental Karachi,203,Throughout hit can bad nor sound southern campaign.
50,Balanced radical infrastructure,Seminar,2025-02-10,Port Grand,125,Cost hold black main public professor attack number together along prevent daughter.
51,Total analyzing methodology,Conference,2024-04-05,Avari Towers,287,Present investment skin nearly help old myself around later bring sound ahead usually culture chair.
52,Monitored homogeneous array,Corporate,2026-01-21,PC Hotel Lahore,160,A design some expert peace window measure check.
53,Seamless leadingedge toolset,Wedding,2024-01-26,Pearl Continental Karachi,486,Let herself great act meet table artist me concern technology case alone factor.
54,Synergized multi-state database,Birthday,2026-02-21,Mohatta Palace,63,Throw cold each nor friend anything serve own relationship group mention point sense garden since.
55,Team-oriented 5thgeneration software,Conference,2025-04-01,PC Hotel Lahore,108,Million environmental section wall effect cold ground short nice which mission mind.
56,Integrated 4thgeneration process improvement,Conference,2026-01-14,Pearl Continental Karachi,460,Produce share what detail lawyer keep big behind cover attack prepare social discover opportunity at behind.
57,Decentralized multimedia focus group,Wedding,2024-11-20,Pearl Continental Karachi,95,Wear would sort share door actually population degree nearly.
58,Reduced coherent implementation,Birthday,2026-11-25,Arts Council Karachi,343,This though list ball town hair start example can organization head treatment their reveal past.
59,Down-sized homogeneous toolset,Seminar,2026-04-28,Mohatta Palace,69,Win would style family usually participant world.
60,Versatile neutral strategy,Private Party,2024-05-24,Serena Hotel Islamabad,446,College environment half measure author thought water low behavior dog why.
61,Object-based optimal capacity,Conference,2026-01-04,Port Grand,109,Foreign enough vote factor amount popular as amount add tell commercial well month.
62,Function-based empowering service-desk,Seminar,2024-01-29,Beach Luxury Hotel,138,Any ability no stock future collection majority policy turn stock none check green race often.
63,Vision-oriented motivating functionalities,Corporate,2026-05-21,Marriott Hotel Karachi,457,Never official sport drive message authority wear rule imagine.
64,Operative holistic data-warehouse,Corporate,2025-03-31,PC Hotel Lahore,316,Someone life among training order natural TV method staff large federal clearly card husband window camera.
65,Monitored actuating portal,Corporate,2026-08-10,PC Hotel Lahore,433,Personal capital onto follow expect protect live sing brother race question control.
66,Switchable leadingedge extranet,Conference,2025-12-18,Mohatta Palace,448,Several sound population financial evidence town rule set.
67,Horizontal holistic collaboration,Corporate,2026-03-30,Avari Towers,255,Have act mission green follow green magazine well.
68,Open-architected grid-enabled process improvement,Private Party,2026-11-16,Serena Hotel Islamabad,482,Surface option yourself only list too action north necessary difference.
69,Profit-focused composite orchestration,Private Party,2026-05-06,Serena Hotel Islamabad,312,Next nation should school trade face less laugh tough raise.
70,Multi-layered incremental interface,Birthday,2026-12-05,Arts Council Karachi,220,Full music check phone network bad computer group.
71,Persistent homogeneous system engine,Conference,2024-04-20,Pearl Continental Karachi,238,Drug consumer number provide animal spend wait early dream particularly.
72,Mandatory 4thgeneration hardware,Birthday,2024-08-04,Avari Towers,312,Push soon health start next indeed rise space difficult company at always.
73,Focused explicit leverage,Seminar,2026-08-17,Mohatta Palace,425,Everybody source customer class citizen off hour.
74,Polarized clear-thinking core,Private Party,2025-08-28,Marriott Hotel Karachi,249,Want out however defense company begin especially civil.
75,Configurable reciprocal support,Birthday,2026-07-04,Mohatta Palace,58,Time feel north against brother surface coach.
76,Self-enabling hybrid encoding,Corporate,2024-05-14,Serena Hotel Islamabad,113,Discussion although recently summer we growth form indeed prevent seven prevent institution.
77,Reduced system-worthy paradigm,Conference,2026-10-16,Avari Towers,465,Someone thousand federal voice traditional firm fast live meeting stop ago everyone us address use training.
78,Future-proofed analyzing synergy,Private Party,2024-03-22,Arts Council Karachi,312,According treatment piece forward alone data suffer space significant.
79,Extended real-time standardization,Seminar,2026-08-25,Mohatta Palace,192,Vote become career century right hotel first able interview such.
80,Automated static standardization,Wedding,2026-10-03,Serena Hotel Islamabad,440,Senior section argue oil write along news a character spend.
81,Team-oriented neutral time-frame,Corporate,2025-01-22,Pearl Continental Karachi,398,Even including five break this view focus.
82,Open-architected 24/7 frame,Corporate,2024-07-14,Arts Council Karachi,121,Another forward nearly wrong live toward need against especially wind feeling information student street front.
83,Seamless web-enabled Internet solution,Corporate,2024-02-13,Serena Hotel Islamabad,240,Account life least window eight put student season couple see color.
84,Reactive radical frame,Corporate,2025-02-01,Arts Council Karachi,484,Scientist skill best sound capital their run so international less sure include relationship enjoy or start.
85,Grass-roots leadingedge matrix,Wedding,2025-05-25,Marriott Hotel Karachi,197,Own interest of must movement your never something lay outside general sort despite some foreign likely.
86,Assimilated system-worthy matrix,Conference,2025-12-14,Karachi Expo Centre,105,Range than bad upon budget arm respond national improve study by benefit national real voice.
87,Enhanced intermediate encoding,Private Party,2025-05-13,Marriott Hotel Karachi,395,Research job ability cup become cultural though industry his since.
88,Assimilated intermediate pricing structure,Wedding,2026-05-21,Pearl Continental Karachi,467,Perform least example food question than organization expert clearly then especially magazine.
89,De-engineered didactic capability,Wedding,2024-04-23,Port Grand,486,Hotel act control western until real report audience understand kid science home already case.
90,Open-source real-time Local Area Network,Corporate,2024-01-13,Serena Hotel Islamabad,468,Question sound wind long realize he trial part just general raise one today write reflect trouble.
91,Open-source incremental Graphical User Interface,Private Party,2025-02-06,Port Grand,204,Tv war future gas but small eye husband process often coach hospital third project easy.
92,De-engineered even-keeled frame,Corporate,2025-06-25,Avari Towers,133,Instead from shake play everybody push join whom.
93,Down-sized stable Graphic Interface,Birthday,2026-02-14,Karachi Expo Centre,252,Husband part impact into street environmental she bill certain fill stage.
94,Organic dedicated matrices,Conference,2026-05-20,Karachi Expo Centre,200,Hundred so seat community task sometimes available world.
95,Synchronized 3rdgeneration artificial intelligence,Conference,2026-06-11,Mohatta Palace,215,Purpose throw foot son cover model stage pull improve month game improve oil sister.
96,Ergonomic global framework,Private Party,2024-04-21,PC Hotel Lahore,373,Member law player best may every under moment sit everything economy guess specific place best.
97,Innovative non-volatile orchestration,Private Party,2025-01-22,Avari Towers,422,War attorney upon choose director address simple wait test certain above money minute fight character let.
98,Implemented 24/7 workforce,Private Party,2024-09-06,Beach Luxury Hotel,144,Design itself main we sing such suffer popular event join community executive water.
99,Front-line bi-directional hardware,Conference,2024-08-04,Serena Hotel Islamabad,258,Get reality agent manage listen west here.
100,Synchronized mission-critical system engine,Seminar,2024-05-08,Karachi Expo Centre,348,Cultural blue nothing executive drive responsibility time resource college few.
